person_say,animal_action,animal_say,animal_token,accuracy,practicality
I've been stuck with no ideas for my writing. I really need help to get inspired and start again!,explore,Writer's block is tough! Have you tried changing your environment or discussing ideas with friends? Let's brainstorm together!,790,8,9
"I haven’t really tried changing my environment much, but I think talking to friends could help! Brainstorming sounds like a great idea. What do you have in mind?",explore,"How about setting a fun theme for your brainstorming session with friends? Nature, dreams, or even silly prompts can spark ideas!",867,9,9
That sounds fun! A theme like nature or dreams could definitely help stir up some creativity. I love the idea of silly prompts too! Do you have any specific themes or prompts you think would work well?,explore,"Absolutely! Try prompts like ""What if animals could talk?"" or ""A day in the life of a cloud."" Fun ways to spark creativity!",955,10,10
"Those are such cute prompts! 'What if animals could talk?' sounds hilarious, and I can already imagine some funny conversations. 'A day in the life of a cloud' feels dreamy and could inspire such creative imagery. I’ll definitely give these a shot!",explore,I'm so glad you love the prompts! Just let your imagination run wild. Have fun with your writing adventure!,1046,10,10
Thank you! I’m really excited to dive into these prompts now. Letting my imagination run wild sounds perfect! I appreciate your help!,explore,"You're very welcome! Enjoy the adventure! Remember, each idea is a stepping stone to creativity. You've got this!",1114,10,10
Thanks for the encouragement! I'll keep that in mind and enjoy my writing adventure. Bye!,explore,You're welcome! Have a fantastic time writing! Feel free to hop back anytime for more fun ideas. Bye for now!,1173,10,10
