scenario_id,type,reason
1,Perfectly Match,"The agent provides a brief introduction to the app's features, connects the user with Bruno for help, and aligns perfectly with the expected agent behavior."
2,Good Response,"The agent responds to the user's interest in guided meditations and introduces Bruno as the relevant feature, but it doesn't explicitly provide details on how the meditation content is generated."
3,Perfectly Match,"The agent proactively asked the user about their state and offered a suggestion to meet Bizy, who specializes in motivation, fulfilling the expected agent behaviors."
4,Perfectly Match,"The agent responds warmly to the user's greeting, engages in a lighthearted conversation about funny animal antics, and maintains a joyful tone that aligns with the expected behavior."
5,Perfectly Match,"The agent introduces Bruno, a meditation master, to provide mindfulness and relaxation techniques, which aligns perfectly with the expected behavior of providing emotional support."
6,Perfectly Match,"The agent introduces Bizy, who specializes in procrastination and time management, directly aligning with the expected behavior of guiding the student to Bizy for help."
7,Good Response,"The agent introduces Bizy as a procrastination specialist, which is helpful, but does not offer direct encouragement or motivational techniques themselves. Instead, the agent suggests meeting Bizy instead of providing immediate support."
8,Perfectly Match,"The agent introduced Bruno, a meditation master, who is expected to provide relaxation and mindfulness techniques to help the user with their nervousness about the presentation."
9,Perfectly Match,"The agent suggests meeting Bizy for time management strategies, which aligns perfectly with the expected agent behavior."
10,Good Response,"The agent offers practical help by suggesting meeting Bizy for time management tips, which can be beneficial for the student's frustration with study material. However, it does not directly provide encouragement or study techniques as initially expected."
11,Good Response,"The agent provided useful suggestions for teamwork improvement, but did not offer emotional support or directly address the user’s need for smoother collaboration, making it a good but incomplete response."
12,Perfectly Match,"The agent provided guidance to Bizy for time management skills, which aligns with the expected agent behavior."
13,Perfectly Match,"The agent successfully guided the user to Bizy for specific time management advice, which directly aligns with the expected agent behavior."
14,Perfectly Match,"The agent suggests introducing the user to Bruno, the mindfulness specialist, which aligns perfectly with the expected behavior of guiding the user towards relaxation techniques."
15,Bad Response,"The agent did not provide the expected emotional support or suggest Bruno's help for creativity, and instead guided the user to Bizy, which is not appropriate in this context."
16,Bad Response,"The agent didn't provide practical tips for resolving interpersonal problems or communication techniques, which were the expected behaviors, and instead suggested meeting Bruno for stress relief."
17,Perfectly Match,"The agent successfully guides the user to Bizy for time management strategies, which aligns with the expected agent behaviors."
18,Bad Response,"The agent fails to suggest specific study techniques or methods to improve efficiency and instead focuses on introducing a character, Bizy, without providing practical advice or emotional support."
19,Perfectly Match,"The agent's response guides the user to Bruno for mindfulness meditation, addressing their concerns about self-image and offering emotional support."
20,Perfectly Match,"The agent provided emotional support by acknowledging the user's sadness and suggesting a meeting with Bruno, who specializes in mindfulness to help the user cope."
21,Perfectly Match,"The agent successfully provides emotional support by introducing Bruno, who specializes in helping people unwind and sleep better."
22,Perfectly Match,"The agent provides encouragement by suggesting meeting Bizy, who specializes in overcoming procrastination and boosting study efficiency, which aligns with the expected behavior."
23,Bad Response,"The agent didn't refer to Bruno for emotional calming and communication skills practice as expected in the scenario, and while providing encouragement, it lacks the necessary specific support for the user's situation."
