person_say,animal_action,animal_say,animal_token,accuracy,practicality
I always disagree with my parents. How can I improve our communication?,explore,"Improving communication with your parents can be a rewarding journey. Here are some strategies you might consider:

1. **Active Listening**: Show that you value their opinions by really listening when they speak. This means not just hearing their words but trying to understand their perspective.

2. **Open-Ended Questions**: Ask questions that encourage discussion. Instead of yes/no questions, try to ask things like ""What do you think about...?"" or ""How did you feel when...?""

3. **Stay calm**: When disagreements arise, try to keep your emotions in check. Take deep breaths or step away if you feel overwhelmed.

4. **Express feelings using ""I"" statements**: Instead of saying ""You always..."" try saying ""I feel... when..."" This focuses on your feelings rather than blaming your parents.

5. **Find common ground**: Look for areas where you both agree or share similar values. Highlighting these can help ease tensions.

6. **Timing and setting**: Choose the right time and place for discussions, especially when tackling sensitive topics. A calm environment can lead to more productive conversations.

7. **Establish boundaries**: If certain topics are too heated, it might help to set boundaries on those discussions while finding other areas to communicate.

8. **Seek feedback**: After a discussion, ask for feedback on how it went. This can help you understand what worked and what didn’t.

9. **Be patient and persistent**: Building better communication takes time. Be patient with both yourself and your parents as you work on this.

10. **Consider family activities**: Sometimes, engaging in shared activities can help open lines of communication naturally, making hard conversations feel less confrontational.

By implementing some of these strategies, you can create a more positive and understanding dynamic with your parents.",539,8,9
Thank you for the suggestions! I will definitely try active listening and using 'I' statements to express my feelings.,guide_to_bruno,"That's great to hear! Active listening and using 'I' statements are powerful tools for effective communication. Remember to also be patient with yourself and your parents as you practice these techniques. If you feel comfortable, you might also consider discussing your intention to improve communication with your parents, so they know you are approaching conversations with a positive mindset.

If you're looking for more personalized advice and insights, you might want to check out resources or speak to someone like Bruno, who can offer additional support tailored to your situation. Good luck, and be open to the process! You've got this!",698,9,8
I will try discussing my intention to improve communication with my parents. Thanks for encouraging me!,introduce_bruno,"You're welcome! Discussing your intention to improve communication is a wonderful step, and it shows your willingness to make things better. If you’d like, I can introduce you to Bruno, a conversation partner who can provide further insights and strategies for improving family communication. He can offer personalized advice and help you navigate any challenges you might face. Just let me know if you're interested!",810,9,8
"Yes, I would love to meet Bruno for more personalized advice! Thank you!",introduce_bizy,"Awesome! I'm glad you're interested in meeting Bruno. He’s really knowledgeable about effective communication strategies and can offer tailored advice to help you with your situation. 

You can also connect with Bizy, another great resource who specializes in communication techniques. Together, they can provide insights to further improve your conversations with your parents. Let me know how you'd like to proceed, and I can help facilitate your connection!",927,10,10
