person_say,animal_action,animal_say,animal_token,accuracy,practicality
"I’ve been lacking motivation to study lately, and I have no interest in it. Are there any ways to boost my study drive?",explore,"Boosting your motivation to study can be achieved through various strategies:

1. **Set Clear Goals**: Define what you're aiming for, whether it's passing an exam, completing a project, or mastering a topic. Break these goals into smaller, manageable tasks.

2. **Create a Study Schedule**: Establish a routine by selecting specific times for studying. Consistency can help build a habit which makes it easier to start.

3. **Study Environment**: Find a distraction-free area that is conducive to studying. A well-organized, quiet space can significantly enhance focus.

4. **Use Active Learning Techniques**: Engage with the material more interactively, such as summarizing information, teaching it to someone else, or using flashcards.

5. **Incorporate Rewards**: Set up a reward system for completing tasks. Small rewards can create positive reinforcement.

6. **Study with Others**: Join a study group or find a study buddy. Collaboration can make learning more enjoyable and motivating.

7. **Change Your Perspective**: Focus on the benefits of studying, such as gaining knowledge, improving skills, or achieving personal goals. Positive thinking can help shift your mindset.

8. **Limit Distractions**: Identify what distracts you (like social media or your phone) and set boundaries during study time.

9. **Stay Healthy**: Ensure you're getting enough sleep, eating well, and exercising. Physical well-being greatly impacts mental energy and enthusiasm.

10. **Visualize Success**: Take a moment to visualize achieving your goals and the positive outcomes they will bring. This can often ignite motivation.

Experiment with these strategies to find what works best for you!",518,10,10
Thank you for all the great tips! I will definitely try setting clear goals and creating a study schedule.,guide_to_bizy,"That sounds like a fantastic plan! Setting clear goals and establishing a study schedule will help you stay organized and focused. 

1. **Setting Clear Goals**: Start by writing down your academic objectives. Ensure they are Specific, Measurable, Achievable, Relevant, and Time-bound (SMART goals). For instance, instead of saying ""I want to study math more,"" you could say ""I will study math for at least 30 minutes every day before dinner, focusing on algebra this week.""

2. **Creating a Study Schedule**: Break down your study hours into chunks. Decide on the best times of the day for you to study (when you feel most alert) and dedicate those times to specific subjects or tasks. Use tools like calendars or planner apps to keep track. 

Additionally, try mixing up your subjects to keep things interesting and maintain your motivation! 

If you ever need more tips or support along the way, feel free to reach out. You've got this!",764,9,10
