person_say,animal_action,animal_say,animal_token
I've been feeling a bit burnt out with studying lately. How can I reignite my interest?,advise,"Buzz! Try setting small, fun goals and take breaks to recharge!",365
"That sounds like a great idea! Setting small goals could really help me feel less overwhelmed, and taking breaks to recharge is super important. What kind of small goals do you think I should try?",advise,"Buzz! Set daily study targets, like a chapter or topic, and reward yourself after each!",445
"I love that! Setting daily study targets feels manageable, and rewarding myself sounds like a fun way to stay motivated. I think I’ll combine that with some doodling breaks too!",advise,Buzz! Combining study with doodling breaks will boost your creativity and focus!,518
"Yes, I'm really excited about that! Doodling always helps me clear my mind. Do you have any other tips on how I can make studying more enjoyable?",advise,Buzz! Try studying with friends or using flashcards and games for a fun twist!,590
Studying with friends sounds so much more fun! And using flashcards and games will definitely make it less dull. I’ll have to plan a study session soon. Thanks for the great ideas!,greet,Buzz buzz! I'm glad you liked the ideas. Enjoy your study session!,666
Thanks! I'm looking forward to it. Bye for now!,greet,Buzz! Have a productive time! Bye for now!,711
