person_say,user_problem,animal_action,animal_say,animal_token,accuracy,practicality
I feel like my current study methods aren't working. I want to improve my study efficiency.,1.Improve study efficiency,explore,It can be tough when study methods don’t click! What specifically isn’t working for you?,861,7,6
I guess I find it hard to focus and remember things when I’m just reading and highlighting. It feels like I’m not really absorbing the material.,1.Hard to focus 2.Hard to remember,explore,"That’s frustrating! Have you considered mixing in some active learning methods, like summarizing or teaching the material?",945,9,8
"I haven’t really thought about that! Teaching the material sounds interesting, but I'm not sure how to start. How do I do that effectively?",1.Hard to focus 2.Hard to remember,explore,"Great idea! You could start by explaining the material to a friend, or even out loud to yourself!",1027,9,9
"That sounds like a good plan! I could definitely try explaining it to my friends or even my pets, haha! It might help me remember things better.",1.Hard to focus 2.Hard to remember,explore,"Haha, pets make great listeners! Plus, discussing can make learning more fun. You’ve got this!",1111,9,9
Thanks! I really appreciate the encouragement. I’ll give it a shot and see how it goes! It might make studying less boring too.,1.Hard to focus 2.Hard to remember,explore,"Absolutely! Making it fun can boost your motivation. Keep up the great work, and enjoy the process!",1192,10,10
Thank you! I will definitely try to enjoy the process. I really appreciate all the advice!,1.Hard to focus 2.Hard to remember,explore,"You're very welcome! Remember, every little step counts. Have fun studying!",1258,8,9
