person_say,user_problem,animal_action,animal_say,animal_token,accuracy,practicality
I've been stuck with no ideas for my writing. I feel so blank and it's frustrating!,1.Writer's block 2.No ideas,explore,I get it! Have you tried jotting down random thoughts or taking a nature walk for inspiration?,865,9,8
"No, I haven't tried that yet! A nature walk could be nice, but I'm not sure it will help. Do you think just jotting down random thoughts will spark something?",1.Writer's block 2.No ideas,explore,"Absolutely! Sometimes, free writing can unlock hidden ideas. Just let your thoughts flow without judgment!",949,9,9
That sounds like a great idea! I can just let my thoughts pour onto the paper without worrying about being perfect. I'll give it a try!,1.Writer's block 2.No ideas,explore,"That's the spirit! Remember, creativity thrives when you're relaxed and free. Have fun with it!",1026,9,9
Thanks! I'll try to enjoy the process and not stress too much. Maybe I can doodle a bit too while I think!,1.Writer's block 2.No ideas,explore,Doodling sounds perfect! It's a great way to let your mind wander and stimulate creativity!,1100,10,10
"I'm excited to start! I love doodling, and it really helps me relax. Hopefully, it leads to some cool ideas for my writing!",1.Writer's block 2.No ideas,explore,That’s a fantastic approach! Enjoy the doodling and writing process—you might surprise yourself with what comes out!,1180,10,10
Thank you! I'm feeling more motivated already. I can't wait to see what I create. I'll keep you posted!,1.Writer's block 2.No ideas,explore,"Yay! I can't wait to hear your creative updates. You've got this, friend!",1250,10,10
