person_say,animal_action,animal_say,animal_token,accuracy,practicality
I'm studying in a noisy environment and it's hard to focus. Do you have any suggestions to help me concentrate better?,advise,"Try using noise-canceling headphones or listening to some calming music while you study. Also, consider setting short focus periods followed by breaks to keep your mind fresh!",710,10,10
Those sound like great suggestions! I will definitely try using noise-canceling headphones and listening to calming music. Setting short focus periods with breaks also seems helpful!,explore,"That's awesome to hear! How do you feel about your study sessions so far? Do you find it easy to take breaks, or is that a challenge for you?",792,10,9
Taking breaks can be a bit challenging for me. Sometimes I get so caught up in studying that I forget to take a break. I think setting those short focus periods will really help me with that!,advise,"It’s great that you're already thinking about those focus periods! You could set a timer, like 25 minutes of studying followed by a 5-minute break. That way, it’s easier to remember to step away and recharge!",895,10,10
That's a wonderful idea! I will definitely try setting a timer for 25 minutes of studying followed by a 5-minute break. Thank you for your helpful suggestion!,advise,"You’re very welcome! I’m excited for you to give it a go. Just remember to enjoy those breaks, too! You've got this!",974,10,10
Thank you! I will try to enjoy my breaks as well. I appreciate your encouragement and support!,advise,I'm glad to hear that! Enjoying your breaks will recharge your mind for even better studying. Keep up the great work!,1036,10,10
Thank you! I really appreciate all your support and suggestions. I will do my best to keep up the great work!,advise,"You’re doing amazing! Just remember to celebrate your progress, no matter how small. You got this!",1098,10,10
