person_say,animal_action,animal_say,animal_token,accuracy,practicality
I've been stuck with no ideas for my writing. Can you suggest something to help me get started?,explore,"It's tough to feel stuck! What's your writing about, or what theme are you interested in exploring?",787,7,6
I'm not sure! I just need some inspiration to figure it out. Could you suggest some themes or ideas that might be interesting to explore?,explore,"How about nature, friendship, adventure, or overcoming challenges? Any of these spark a little inspiration?",852,8,8
Those themes sound great! I think nature and adventure could really spark my creativity. Could you help me brainstorm some specific ideas related to those?,explore,Sure! How about writing about a journey through a magical forest or an explorer discovering a hidden waterfall?,917,9,9
Both ideas sound amazing! A journey through a magical forest really intrigues me. Could you suggest some more details or plot points for that story?,explore,"Consider adding a quirky guide, mystical creatures, a treasure to find, or a challenge to overcome in the forest!",986,9,9
I love those suggestions! A quirky guide and mystical creatures would make the story so fun. Could you help me think of a unique character for the guide?,explore,How about a witty squirrel with a talent for puzzles and riddles? They could lead your character with clever hints!,1057,9,9
A witty squirrel sounds perfect! I can already imagine their clever hints guiding my character. Thank you for the suggestion! Is there anything else I should consider for this story?,explore,Think about the character's goal and what they learn on their journey. Adding depth can make it more engaging!,1130,9,9
That's a great idea! I'll definitely think about the character's goal and what lessons they learn along the way. Thank you for your help! I feel more inspired now.,explore,"Yay! I'm so glad to hear that! Enjoy writing your magical adventure, and let your creativity flow!",1203,10,10
