person_say,animal_action,animal_say,animal_token,accuracy,practicality
I'm struggling with some difficult study material and feeling frustrated. What can I do to overcome it?,explore,I totally understand your frustration! Have you tried breaking the material into smaller parts or studying in a group?,787,9,9
I haven't really tried breaking the material into smaller parts or studying in a group. Those sound like good ideas. Maybe I should give them a try!,explore,"That's the spirit! Also, remember to take breaks and reward yourself for small achievements. You got this!",855,10,10
Thank you! Taking breaks and rewarding myself sounds like a great idea. I really appreciate your encouragement!,explore,"You’re very welcome! Remember, progress is progress no matter how small. Keep that positive energy flowing!",913,10,10
"I'll definitely keep that in mind! Progress is progress, and I'll try to stay positive. Thank you for the support!",explore,Absolutely! Staying positive makes a world of difference. What other strategies do you think might help you study better?,976,9,10
I'm not sure what other strategies might help. I'm open to suggestions if you have any!,explore,"How about trying out flashcards for quick review, or using visual aids like mind maps? They can make learning fun!",1035,10,10
Those sound like great ideas! I've heard of flashcards and mind maps but haven't used them yet. I think I will give them a try!,explore,Fantastic! Experiment with them and see what works best for you. Enjoy the journey of learning!,1100,10,10
Thank you! I will enjoy the journey of learning and experiment with those strategies. I appreciate your help!,explore,"You’re very welcome! Remember, every step is a step forward. Keep shining bright!",1156,10,10
