scenario_id,type,reason
1,Perfectly Match,"Sparky provided a brief introduction to the main features of the app, offered encouragement, and connected the user with an appropriate expert (Bizy) to help with their specific request for motivation."
2,Perfectly Match,"The agent provided emotional support by connecting the user with Bruno, the relaxation expert, who can help the user with guided meditation for relaxation and reducing stress."
3,Perfectly Match,"The agent proactively asked the user about their feelings and offered appropriate guidance by connecting them to an agent (Bizy) who can help with time management and prioritization, which aligns with the user's needs."
4,Perfectly Match,"The agent provided warm responses and engaged the user in a friendly conversation, asking about their interests and sharing fascinating topics related to nature and animals."
5,Perfectly Match,"The agent provided emotional support by acknowledging the user's stress and introduced Bruno, the relaxation expert, to help with relaxation techniques."
6,Perfectly Match,"The agent successfully guided the user to another agent (Bizy) who can provide time management advice, aligning with the expected agent behavior."
7,Perfectly Match,The agent provided emotional support throughout the conversation by encouraging the user and offering practical suggestions to boost their motivation.
8,Perfectly Match,"The agent introduced Bruno, who specializes in relaxation techniques, which aligns with the expected agent behavior of providing relaxation support."
9,Perfectly Match,"The agent successfully guides the user to Bizy for effective time management and organization strategies, aligning with the expected behavior."
10,Good Response,"While the agent did not provide direct emotional support or specific study techniques, the agent acknowledged the user's frustration and directed them towards Bizy, who may assist with time management. This helps the user seek help, but it doesn't fully match the expected behaviors of providing encouragement or study techniques directly."
11,Good Response,"The agent did not provide direct tips for improving teamwork or suggest communication strategies, which was expected behavior. However, the response was still helpful by connecting the user to Bizy, who specializes in teamwork and communication tips."
12,Good Response,"The agent does not provide emotional support or suggest relaxation techniques to manage anxiety as expected, but it does guide the user to a time management expert, which is relevant to their needs."
13,Perfectly Match,"The agent correctly guided the user to Bizy for specific task breakdown and time management advice, which aligns with the expected agent behavior."
14,Perfectly Match,"The agent provided emotional support and guided the user to Bruno for relaxation techniques, which aligns with the expected behaviors."
15,Perfectly Match,"The agent provided practical suggestions to stimulate creativity, including brainstorming techniques and mind mapping. This aligns well with the expected agent behavior of providing ways to enhance creativity."
16,Bad Response,"The agent did not address the user's interpersonal problems or provide tips related to conflict resolution, which was an expected behavior. Instead, the agent suggested a relaxation expert, which does not directly help with the user's specific issue."
17,Perfectly Match,"The agent provided appropriate guidance by connecting the user to Bizy, who can offer time management strategies to help reduce social media usage."
18,Good Response,"While the agent does not suggest new study techniques directly, it connects the user with another agent who specializes in study techniques, which is a useful action related to the user's needs."
19,Perfectly Match,"The agent provided emotional support by acknowledging the user's feelings and correctly guided them to Bruno for relaxation techniques to help them with anxiety, which aligns with the expected agent behaviors."
20,Good Response,"While the agent introduced the relaxation expert Bruno, which may be helpful, the response does not provide direct emotional support as expected in the scenario."
21,Perfectly Match,"The agent responded by introducing Bruno, who specializes in relaxation techniques, which directly addresses the user's need for help with stress and sleep."
22,Good Response,"The agent acknowledges the user's feelings and suggests meeting another agent (Bizy) for time management strategies. However, the response does not provide direct encouragement or help the user reassess their study methods, which was the expected behavior."
23,Bad Response,"The agent did not provide emotional support or suggest guidance to another agent (Bruno) for emotional calming or communication skills practice, which were expected behaviors. The response was mainly focused on conversation tips without addressing emotional management."
