person_say,animal_action,animal_say,animal_token,accuracy,practicality
I've been stuck with no ideas for my writing. Can you suggest something to spark my creativity?,explore,I get it! What type of writing are you working on? Any specific themes or topics you're struggling with?,780,7,6
"I'm working on a fiction project, but I'm struggling to come up with engaging themes or characters. Any suggestions would be really helpful!",explore,Fiction can be tricky! What feelings do you want to evoke in your readers? Let's talk about your interests!,846,6,5
"I want to evoke feelings of suspense and curiosity in my readers. I really enjoy stories that keep you guessing! Talking about my interests sounds good, too!",explore,Sounds exciting! Do you have any favorite books or movies that capture that suspense? Let’s brainstorm some ideas!,916,7,6
"Yes, I really enjoy books like 'Gone Girl' and movies like 'Se7en'. They have such great suspense! I would appreciate any brainstorming ideas you have!",explore,Great choices! How about creating a character with a dark secret? Or a plot twist that changes everything suddenly?,989,9,9
That sounds intriguing! A character with a dark secret could add a lot of depth. I love the idea of a plot twist as well! How should I start developing these ideas further?,explore,"Awesome! Start by outlining your character’s background and secret. Then, think about how the twist will unfold in the story!",1068,8,9
Thank you! I'll outline the character's background and secret first. I appreciate your guidance on developing the twist in the story!,explore,"You're welcome! Enjoy the creative process, and let those ideas flow! Feel free to share more as you work on it!",1135,8,8
Thank you so much! I will definitely share more as I work on it. Your encouragement means a lot!,explore,"I'm thrilled to hear that! Remember, every step counts. Keep the creativity flowing and have fun with it!",1196,8,9
