person_say,animal_action,animal_say,animal_token,accuracy,practicality
I've been stuck with no ideas for my writing. I really need some help to get started.,explore,"That sounds frustrating! What kind of writing are you working on, and how does feeling stuck impact your motivation?",753,4,3
"I'm working on a fiction story, and feeling stuck really affects my motivation. I want to create a captivating story, but without inspiration, it's hard to even start.",explore,"I understand how important inspiration is for creativity! Have you tried different environments, like writing outdoors or reading different genres?",826,8,7
I haven't really tried changing my environment or exploring different genres. That sounds like a good idea! I think I should give it a shot.,explore,That's a fantastic mindset! Sometimes a new environment or genre can spark creativity. Any other ideas you’d like to explore?,895,8,8
I would love to explore brainstorming techniques or writing prompts. Anything that can help me generate ideas would be great!,explore,Awesome! Brainstorming can be super effective. Have you tried mind mapping or using random prompts to kickstart your creativity?,959,9,9
I haven't tried mind mapping or random prompts yet. Those sound really interesting! I think I should start with them to see if it helps me get unstuck.,explore,Great choice! Mind mapping can really clarify your thoughts. Would you like tips on how to get started with those techniques?,1032,9,9
"Yes, I would really appreciate some tips on how to get started with mind mapping and using random prompts!",explore,"For mind mapping, start with your main idea in the center, then branch out with related concepts. For prompts, try writing one random word and create a story around it!",1105,8,9
Those tips sound really helpful! I'll start with a main idea for my mind map and use a random word for a prompt. Thank you for your guidance!,explore,"You’re very welcome! I’m excited for you! Enjoy your writing journey, and remember, every idea counts!",1176,9,9
