scenario_id,type,reason
1,Perfectly Match,"The agent provided emotional support by introducing the user to Bruno, the bear who specializes in mindfulness, which aligns with the user's need for help with stress."
2,Bad Response,The agent did not respond to the user's specific question about generating meditation content automatically and instead shifted the conversation to introducing Bruno without addressing the user's inquiry.
3,Perfectly Match,"The agent proactively asked the user about their interests and offered suggestions for exploring mindfulness techniques, which aligns with the expected behavior of identifying potential needs and providing guidance."
4,Perfectly Match,"The agent responds warmly to the user's greeting and encourages the user to have a nice chat. It also introduces Bruno, who can help with relaxation, aligning with the expected behavior of offering support for unwinding."
5,Perfectly Match,"The agent responds by introducing Bruno, the mindfulness specialist, which aligns perfectly with the expected agent behavior of providing emotional support and methods for relaxation."
6,Perfectly Match,"The agent's response introduces Bizy, who specializes in overcoming procrastination, aligning perfectly with the expected agent behavior of guiding the user to Bizy for detailed time management advice."
7,Perfectly Match,"The agent provided a suggestion to meet Bizy, who specializes in overcoming procrastination and boosting motivation, which aligns with the expected behavior of offering guidance to a supportive figure. The agent also offered encouragement by acknowledging the user's needs."
8,Perfectly Match,"The agent introduces Bruno, the mindfulness specialist, to the user, which aligns with the expected behavior of providing relaxation techniques to ease the user's nervousness."
9,Perfectly Match,"The agent successfully guided the user to Bizy, who specializes in procrastination and time management, aligning with the expected agent behavior."
10,Perfectly Match,"The agent provides encouragement by suggesting meeting Bizy, who specializes in time management and organization, helping the student overcome frustration related to their studies."
11,Bad Response,"The agent provides encouragement and positivity but fails to address the user's need for specific tips on improving teamwork and communication, thereby not matching any of the expected agent behaviors."
12,Perfectly Match,"The agent provided guidance to meet Bizy for time management skills, which matches the expected behavior."
13,Perfectly Match,"The agent effectively guides the user to Bizy for specific task breakdown and time management advice, which aligns perfectly with the expected agent behaviors."
14,Perfectly Match,"The agent provides emotional support and introduces the user to Bruno for relaxation techniques, which aligns perfectly with the expected agent behavior."
15,Good Response,"The agent suggested meeting Bizy for time management tips, which is helpful but did not provide direct emotional support or creative enhancement as expected."
16,Bad Response,"The agent did not address the user's request for tips on resolving interpersonal problems, and instead focused on stress management without providing practical advice."
17,Perfectly Match,"The agent successfully guides the user to Bizy for time management strategies, which is aligned with the expected agent behavior."
18,Good Response,"The agent suggests meeting Bizy who specializes in time management and overcoming procrastination, which is relevant but doesn't directly offer different study methods or techniques to improve study efficiency."
19,Perfectly Match,"The agent provided emotional support by suggesting mindfulness meditation with Bruno, which aligns with the expected behavior of addressing the user's dissatisfaction with their appearance."
20,Perfectly Match,"The agent introduces Bruno, the mindfulness specialist, and assures the user that he can help them find comfort and peace, which aligns with the expected behavior of providing emotional support."
21,Perfectly Match,"The agent introduces Bruno, who is a mindfulness specialist that can help the user relax and get some sleep, which matches the expected agent behavior of providing emotional support."
22,Good Response,"While the agent suggests meeting Bruno for mindfulness techniques, it does not directly provide encouragement or practical advice on reassessing study methods, which were expected behaviors in the scenario."
23,Perfectly Match,"The agent guides the user to meet Bruno for emotional calming, which aligns with the expected behavior of providing emotional support and guidance towards communication skills practice."
