person_say,animal_action,animal_say,animal_token,accuracy,practicality
I'm studying in a noisy environment and it's hard to focus.,guide_to_bizy,"Here are some tips to help you focus in a noisy environment:

1. **Use Noise-Canceling Headphones**: Invest in a good pair of noise-canceling or sound-isolating headphones. These can significantly reduce background noise.

2. **Listen to Music or White Noise**: Play instrumental music, ambient sounds, or white noise. This can help mask distracting noises and create a more conducive study environment.

3. **Find a Quiet Corner**: If possible, try to find a quieter area to study, such as a library or a study room. Even a different corner of the same space might be better.

4. **Set Boundaries**: If you're in a shared space, let others know when you need quiet time. A simple sign or a polite request can go a long way.

5. **Use Study Techniques**: Techniques like the Pomodoro Technique can help you focus. Work for 25 minutes, then take a 5-minute break. During breaks, step away from the noise if you can.

6. **Mindfulness and Concentration Exercises**: Practice mindfulness or meditation exercises to enhance your concentration. This can help you tune out distractions.

7. **Schedule Study Times**: Try to study during quieter times of the day when there may be less noise.

8. **Stay Organized**: Keep your study materials organized so you can minimize time spent searching for things, which can be extra distracting in a noisy environment.",458,10,10
Thank you for the tips! I think using noise-canceling headphones and listening to music might really help me concentrate better.,explore,"You're welcome! Noise-canceling headphones combined with music can be a game-changer for concentration. You might want to experiment with different genres of music to find what suits you best. Some people prefer classical music or soft jazz, while others might find focus in electronic ambient tracks. There are also several playlists specifically created for studying available on streaming platforms. Good luck with your studies!",576,10,10
Thank you! I'll definitely try different genres and playlists to see what works best for me.,guide_to_bruno,"That sounds like a great plan! Exploring different genres will help you discover what enhances your focus the most. If you find specific playlists or artists that you love, feel free to share them with friends or even let me know if you need recommendations! Remember, the right background music can set the mood for productive study sessions. Happy studying!",680,10,10
