person_say,animal_action,animal_say,animal_token,accuracy,practicality
I’m having a hard time with all this information and don’t know how to organize it efficiently. Do you have any suggestions?,explore,"Organizing information can indeed be challenging! Here are some suggestions:

1. **Categorization**: Start by grouping your information into categories or topics. This will help you see the relationships and prioritize what’s most important.

2. **Mind Mapping**: Use a mind map to visually organize your ideas. Begin with a central idea and branch out into subtopics and details.

3. **Digital Tools**: Consider using organizational tools like Trello, Notion, or Evernote. These can help you keep everything in one place and allow for easy retrieval and editing.

4. **Checklists**: Creating checklists can help break down large tasks into manageable steps, making it easier to tackle each part.

5. **Prioritization**: Rank your information by importance and urgency. Focus on what requires immediate attention first.

6. **Summarization**: Try to summarize sections of information into key points. This can make it easier to digest and remember.

7. **Regular Review**: Schedule regular reviews of your information to keep everything fresh and to adjust your organization system as needed.

8. **Indexing/Tagging**: If you're using digital files, use indexing or tagging to locate information faster. 

Remember, the best organizational method is one that works well for you, so feel free to adjust these suggestions as needed!",448,8,9
Thank you for the suggestions! I think starting with categorization and maybe trying a mind map would be really helpful. I'll definitely explore some digital tools too. This feels a bit more manageable now!,guide_to_bizy,"You're welcome! I'm glad to hear that you're feeling more manageable about it. 

Starting with categorization and mind mapping can really help in visualizing your ideas and organizing your information effectively. 

As for digital tools, here are a few popular options:
- **Trello**: Great for creating boards and lists. You can easily drag and drop tasks between categories.
- **Notion**: Versatile for notes, documents, databases, and more. It can serve as an all-in-one workspace.
- **MindMeister**: Specifically for mind mapping, where you can create and share your visual maps easily.
- **Evernote**: Excellent for note-taking, organizing, and syncing across devices.

Be sure to give yourself some time to experiment with these tools and find the one that suits your workflow best. If you need further guidance or tips as you go along, feel free to ask. Good luck!",700,9,9
"Thank you for the recommendations! I’ll definitely look into Trello and Notion, as they seem really helpful for organizing. I appreciate your support and will reach out if I need more help!",introduce_bizy,"You're very welcome! Trello and Notion are indeed fantastic tools for organization, and you'll likely find them both useful for different purposes. Remember to take your time exploring their features so you can maximize their potential. 

If you ever need more recommendations or assistance as you start using them or if any other questions come up, don’t hesitate to reach out. Best of luck on your journey to better organization!",841,10,10
Thank you! I really appreciate your help and encouragement. I feel more confident now. I'll reach out if I have more questions. Have a great day!,introduce_bruno,"You're very welcome! I'm thrilled to hear that you're feeling more confident. Remember, organizing information is a journey, and it's great to see you taking the first steps. 

Feel free to reach out anytime if you have more questions or need further assistance. Have a fantastic day, and good luck with your organizational efforts!",956,10,10
