person_say,animal_action,animal_say,animal_token,accuracy,practicality
I always disagree with my parents. How can I improve our communication?,advise,Improving communication with parents can start with active listening and expressing your feelings calmly. Try scheduling time to talk about your thoughts and concerns without interruptions!,610,8,8
That sounds like a great idea! I will try scheduling some time to talk and express my feelings calmly.,advise,"That's wonderful to hear! Remember, it's all about understanding each other better—just like a cozy chat among friends in the forest!",674,8,9
I like that metaphor! It does sound nice to have a cozy chat like friends. I hope to create that atmosphere with my parents.,advise,"I'm sure you'll create a warm and inviting atmosphere! Just like the sun shining through the trees, your positive attitude will help brighten the conversation!",746,9,8
Thank you! I hope my positive attitude makes the conversation feel brighter and more open.,advise,Absolutely! Your positivity is like a friendly deer joining the party—it's bound to make everything feel more inviting and fun!,804,8,7
That's such a cute analogy! I never thought of it that way. I'll try to be that friendly deer during our conversations.,advise,"I love that you’re embracing the friendly deer spirit! Just remember, even deer sometimes juggle their emotions—it's okay to express what you feel, too!",878,9,8
That's true! I'll make sure to express my feelings honestly while staying friendly. Thank you for the encouragement!,advise,"You're very welcome! With your honest approach and friendly demeanor, your conversations will surely blossom like flowers in spring!",938,8,9
Thank you! I really hope they blossom like flowers. Your support means a lot to me!,advise,"I'm so glad to hear that! Remember, with patience and kindness, you'll create a beautiful garden of communication with your parents!",999,9,9
That's a lovely thought! I will keep patience and kindness in mind as I work on our communication.,advise,"That’s a great plan! Like a wise old owl, take your time, and you'll see your efforts lead to a harmonious connection!",1063,8,9
